,Adjusted P-value,Combined Score,Gene_set,Genes,Odds Ratio,Old Adjusted P-value,Old P-value,Overlap,P-value,Term
0,5.216262993829953e-06,15597.401862720995,Reactome_2016,FGB;FGA;FGG,800.0,0,0,3/15,3.409322218189512e-09,GRB2:SOS provides linkage to MAPK signaling for Integrins_Homo sapiens_R-HSA-354194
1,2.608131496914976e-06,15597.401862720995,Reactome_2016,FGB;FGA;FGG,800.0,0,0,3/15,3.409322218189512e-09,p130Cas linkage to MAPK signaling for integrins_Homo sapiens_R-HSA-372708
2,1.8212671475413144e-06,2963.8687679908912,Reactome_2016,FGB;FGA;FGG;ALB,152.38095238095238,0,0,4/105,3.571112054002577e-09,Platelet degranulation_Homo sapiens_R-HSA-114608
3,1.6493615650507157e-06,2801.7237714134553,Reactome_2016,FGB;FGA;FGG;ALB,145.45454545454544,0,0,4/110,4.312056379217557e-09,Response to elevated platelet cytosolic Ca2+_Homo sapiens_R-HSA-76005
4,3.529231567916214e-06,9969.826635715215,Reactome_2016,FGB;FGA;FGG,545.4545454545454,0,0,3/22,1.1533436496458214e-08,Common Pathway of Fibrin Clot Formation_Homo sapiens_R-HSA-140875
5,5.584005143055944e-06,7838.607918501634,Reactome_2016,FGB;FGA;FGG,444.44444444444434,0,0,3/27,2.1898059384533117e-08,Integrin alphaIIb beta3 signaling_Homo sapiens_R-HSA-354192
6,1.2705009157038752e-05,5403.4466224153475,Reactome_2016,FGB;FGA;FGG,324.3243243243243,0,0,3/37,5.81274928753407e-08,Platelet Aggregation (Plug Formation)_Homo sapiens_R-HSA-76009
7,1.2068867937126098e-05,5235.304039394579,Reactome_2016,FGB;FGA;FGG,315.7894736842105,0,0,3/38,6.310519182811031e-08,MAP2K and MAPK activation_Homo sapiens_R-HSA-5674135
8,1.1621014615194611e-05,5076.459671114095,Reactome_2016,FGB;FGA;FGG,307.6923076923077,0,0,3/39,6.835890950114476e-08,Formation of Fibrin Clot (Clotting Cascade)_Homo sapiens_R-HSA-140877
9,1.8941130211500115e-05,1005.8253103634146,Reactome_2016,FGB;FGA;FGG;ALB,63.24110671936759,0,0,4/253,1.2379823667647134e-07,"Platelet activation, signaling and aggregation_Homo sapiens_R-HSA-76002"
10,4.9736243063795145e-05,2658.609742480765,Reactome_2016,FGB;FGA;FGG,179.1044776119403,0,0,3/67,3.5758083248480175e-07,Integrin cell surface interactions_Homo sapiens_R-HSA-216083
11,0.00035797655960915755,370.5263598335587,Reactome_2016,FGB;FGA;FGG;ALB,28.98550724637681,0,0,4/552,2.807659291052216e-06,Hemostasis_Homo sapiens_R-HSA-109582
12,0.0018524585571395237,564.7309904315191,Reactome_2016,FGB;FGA;FGG,51.06382978723404,0,0,3/235,1.5739843949551512e-05,GRB2 events in EGFR signaling_Homo sapiens_R-HSA-179812
13,0.001720140088772415,564.7309904315191,Reactome_2016,FGB;FGA;FGG,51.06382978723404,0,0,3/235,1.5739843949551512e-05,SHC1 events in EGFR signaling_Homo sapiens_R-HSA-180336
14,0.0016054640828542539,564.7309904315191,Reactome_2016,FGB;FGA;FGG,51.06382978723404,0,0,3/235,1.5739843949551512e-05,SOS-mediated signalling_Homo sapiens_R-HSA-112412
15,0.001505122577675863,564.7309904315191,Reactome_2016,FGB;FGA;FGG,51.06382978723404,0,0,3/235,1.5739843949551512e-05,SHC1 events in ERBB4 signaling_Homo sapiens_R-HSA-1250347
16,0.0014165859554596358,564.7309904315191,Reactome_2016,FGB;FGA;FGG,51.06382978723404,0,0,3/235,1.5739843949551512e-05,RAF/MAP kinase cascade_Homo sapiens_R-HSA-5673001
17,0.0013550104449655395,561.6913918326533,Reactome_2016,FGB;FGA;FGG,50.847457627118644,0,0,3/236,1.5941299352535763e-05,FRS-mediated FGFR2 signaling_Homo sapiens_R-HSA-5654700
18,0.001283694105756827,561.6913918326533,Reactome_2016,FGB;FGA;FGG,50.847457627118644,0,0,3/236,1.5941299352535763e-05,FRS-mediated FGFR4 signaling_Homo sapiens_R-HSA-5654712
19,0.0012195094004689858,561.6913918326533,Reactome_2016,FGB;FGA;FGG,50.847457627118644,0,0,3/236,1.5941299352535763e-05,FRS-mediated FGFR3 signaling_Homo sapiens_R-HSA-5654706
20,0.0011614375242561769,561.6913918326533,Reactome_2016,FGB;FGA;FGG,50.847457627118644,0,0,3/236,1.5941299352535763e-05,FRS-mediated FGFR1 signaling_Homo sapiens_R-HSA-5654693
21,0.0011513876812445473,552.7414868156201,Reactome_2016,FGB;FGA;FGG,50.20920502092049,0,0,3/239,1.6555901298941205e-05,ARMS-mediated activation_Homo sapiens_R-HSA-170984
22,0.001101327347277393,552.7414868156201,Reactome_2016,FGB;FGA;FGG,50.20920502092049,0,0,3/239,1.6555901298941205e-05,Signalling to p38 via RIT and RIN_Homo sapiens_R-HSA-187706
23,0.0010687179912279552,549.8132335964285,Reactome_2016,FGB;FGA;FGG,50.0,0,0,3/240,1.6764203783967925e-05,Frs2-mediated activation_Homo sapiens_R-HSA-170968
24,0.0010388232109188155,546.9118966292568,Reactome_2016,FGB;FGA;FGG,49.79253112033194,0,0,3/241,1.697423547252967e-05,MAPK1/MAPK3 signaling_Homo sapiens_R-HSA-5684996
25,0.0010113301963635855,544.0371205740273,Reactome_2016,FGB;FGA;FGG,49.586776859504134,0,0,3/242,1.7186003336897532e-05,Prolonged ERK activation events_Homo sapiens_R-HSA-169893
26,0.0009859724794702598,541.1885562183254,Reactome_2016,FGB;FGA;FGG,49.382716049382715,0,0,3/243,1.739951434359282e-05,Signaling by Leptin_Homo sapiens_R-HSA-2586552
27,0.0009743801524770516,535.5686955622486,Reactome_2016,FGB;FGA;FGG,48.979591836734684,0,0,3/245,1.7831793640102905e-05,Interleukin receptor SHC signaling_Homo sapiens_R-HSA-912526
28,0.0009523234848911784,532.7967302554354,Reactome_2016,FGB;FGA;FGG,48.78048780487804,0,0,3/246,1.805057585741449e-05,Signalling to RAS_Homo sapiens_R-HSA-167044
29,0.0009431664708249092,527.3270995363036,Reactome_2016,FGB;FGA;FGG,48.38709677419354,0,0,3/248,1.8493460212253127e-05,VEGFR2 mediated cell proliferation_Homo sapiens_R-HSA-5218921
30,0.0009575185836278617,516.676249452882,Reactome_2016,FGB;FGA;FGG,47.61904761904761,0,0,3/252,1.9400703328407654e-05,Interleukin-2 signaling_Homo sapiens_R-HSA-451927
31,0.0009386563615707273,514.0718523055374,Reactome_2016,FGB;FGA;FGG,47.43083003952569,0,0,3/253,1.9632028477296257e-05,Signalling to ERKs_Homo sapiens_R-HSA-187687
32,0.0009990769917568238,494.0319156956194,Reactome_2016,FGB;FGA;FGG,45.977011494252864,0,0,3/261,2.1548719430049145e-05,"Interleukin-3, 5 and GM-CSF signaling_Homo sapiens_R-HSA-512988"
33,0.0010263315085495145,482.18467517791936,Reactome_2016,FGB;FGA;FGG,45.11278195488721,0,0,3/266,2.2807366856655873e-05,NCAM signaling for neurite out-growth_Homo sapiens_R-HSA-375165
34,0.0011999154264502258,445.364487160159,Reactome_2016,FGB;FGA;FGG,42.402826855123685,0,0,3/283,2.744904570310974e-05,Extracellular matrix organization_Homo sapiens_R-HSA-1474244
35,0.0011789498878113968,443.35078471425453,Reactome_2016,FGB;FGA;FGG,42.25352112676056,0,0,3/284,2.7739997360268158e-05,IRS-mediated signalling_Homo sapiens_R-HSA-112399
36,0.0011470863773300074,443.35078471425453,Reactome_2016,FGB;FGA;FGG,42.25352112676056,0,0,3/284,2.7739997360268158e-05,MAPK family signaling cascades_Homo sapiens_R-HSA-5683057
37,0.0011525362194938586,437.40322834932397,Reactome_2016,FGB;FGA;FGG,41.811846689895475,0,0,3/287,2.862508257566446e-05,Insulin receptor signalling cascade_Homo sapiens_R-HSA-74751
38,0.0011347190322455226,435.4513156513832,Reactome_2016,FGB;FGA;FGG,41.66666666666666,0,0,3/288,2.8924210625866272e-05,IGF1R signaling cascade_Homo sapiens_R-HSA-2428924
39,0.0011063510564393848,435.4513156513832,Reactome_2016,FGB;FGA;FGG,41.66666666666666,0,0,3/288,2.8924210625866272e-05,Signaling by Type 1 Insulin-like Growth Factor 1 Receptor (IGF1R)_Homo sapiens_R-HSA-2404192
40,0.001079366884331107,435.4513156513832,Reactome_2016,FGB;FGA;FGG,41.66666666666666,0,0,3/288,2.8924210625866272e-05,IRS-related events triggered by IGF1R_Homo sapiens_R-HSA-2428928
41,0.0010646395696109724,433.51442348076796,Reactome_2016,FGB;FGA;FGG,41.522491349480966,0,0,3/289,2.9225399950105128e-05,FCERI mediated MAPK activation_Homo sapiens_R-HSA-2871796
42,0.0012946979814163553,394.39102490187173,Reactome_2016,FGB;FGA;FGG,38.58520900321544,0,0,3/311,3.6386936732616523e-05,Signaling by Insulin receptor_Homo sapiens_R-HSA-74752
43,0.0013777657547467187,380.10470589776884,Reactome_2016,FGB;FGA;FGG,37.5,0,0,3/320,3.96220217051344e-05,VEGFA-VEGFR2 Pathway_Homo sapiens_R-HSA-4420097
44,0.0014109581214839164,372.54818995176583,Reactome_2016,FGB;FGA;FGG,36.92307692307693,0,0,3/325,4.149876827893873e-05,Signaling by SCF-KIT_Homo sapiens_R-HSA-1433557
45,0.0014186601534620536,368.13746431439665,Reactome_2016,FGB;FGA;FGG,36.58536585365854,0,0,3/328,4.26525274897088e-05,Signaling by VEGF_Homo sapiens_R-HSA-194138
46,0.0014011470830567565,366.68715302650634,Reactome_2016,FGB;FGA;FGG,36.474164133738604,0,0,3/329,4.3041773139652e-05,Downstream signaling of activated FGFR2_Homo sapiens_R-HSA-5654696
47,0.0013719565188264073,366.68715302650634,Reactome_2016,FGB;FGA;FGG,36.474164133738604,0,0,3/329,4.3041773139652e-05,Downstream signaling of activated FGFR4_Homo sapiens_R-HSA-5654716
48,0.0013439574061972972,366.68715302650634,Reactome_2016,FGB;FGA;FGG,36.474164133738604,0,0,3/329,4.3041773139652e-05,Downstream signaling of activated FGFR3_Homo sapiens_R-HSA-5654708
49,0.0013290608071200882,365.2466456441945,Reactome_2016,FGB;FGA;FGG,36.36363636363636,0,0,3/330,4.34333597098068e-05,Signaling by ERBB4_Homo sapiens_R-HSA-1236394
50,0.0013267074810147288,362.3946638279026,Reactome_2016,FGB;FGA;FGG,36.14457831325301,0,0,3/332,4.4223582700490974e-05,Signaling by FGFR4_Homo sapiens_R-HSA-5654743
51,0.0013011938756105994,362.3946638279026,Reactome_2016,FGB;FGA;FGG,36.14457831325301,0,0,3/332,4.4223582700490974e-05,Downstream signaling of activated FGFR1_Homo sapiens_R-HSA-5654687
52,0.0012881512451881135,360.9830029780175,Reactome_2016,FGB;FGA;FGG,36.03603603603604,0,0,3/333,4.462223267645099e-05,Signaling by FGFR3_Homo sapiens_R-HSA-5654741
53,0.0012985851677485849,356.80424669649307,Reactome_2016,FGB;FGA;FGG,35.714285714285715,0,0,3/336,4.583241768524418e-05,Signaling by FGFR1_Homo sapiens_R-HSA-5654736
54,0.0013324143747151342,350.021788584232,Reactome_2016,FGB;FGA;FGG,35.19061583577714,0,0,3/341,4.789724876426953e-05,Downstream signal transduction_Homo sapiens_R-HSA-186763
55,0.0013432623602760794,346.05786105628283,Reactome_2016,FGB;FGA;FGG,34.883720930232556,0,0,3/344,4.916515828461466e-05,DAP12 signaling_Homo sapiens_R-HSA-2424491
56,0.0014495703550762538,332.1620220795412,Reactome_2016,FGB;FGA;FGG,33.80281690140845,0,0,3/355,5.400360146362515e-05,Signaling by EGFR_Homo sapiens_R-HSA-177929
57,0.0014729693906397774,327.34445434572376,Reactome_2016,FGB;FGA;FGG,33.42618384401114,0,0,3/359,5.5838055331442556e-05,DAP12 interactions_Homo sapiens_R-HSA-2172127
58,0.0014721845350875837,324.9803924710131,Reactome_2016,FGB;FGA;FGG,33.2409972299169,0,0,3/361,5.677051475174342e-05,Signaling by FGFR2_Homo sapiens_R-HSA-5654738
59,0.0014838040835040882,321.4887235489691,Reactome_2016,FGB;FGA;FGG,32.967032967032964,0,0,3/364,5.818839543153289e-05,Signaling by PDGF_Homo sapiens_R-HSA-186797
60,0.00148351112055045,319.19648433825006,Reactome_2016,FGB;FGA;FGG,32.786885245901644,0,0,3/366,5.914652179972382e-05,Signaling by FGFR_Homo sapiens_R-HSA-190236
61,0.0015567297991817925,310.3012803180849,Reactome_2016,FGB;FGA;FGG,32.085561497326196,0,0,3/374,6.308316833285695e-05,NGF signalling via TRKA from the plasma membrane_Homo sapiens_R-HSA-187037
62,0.0017622791079827016,291.76639738565046,Reactome_2016,FGB;FGA;FGG,30.612244897959183,0,0,3/392,7.256443385811125e-05,Signaling by Interleukins_Homo sapiens_R-HSA-449147
63,0.0017745764226005524,288.8607630596684,Reactome_2016,FGB;FGA;FGG,30.37974683544304,0,0,3/395,7.423064774276821e-05,Fc epsilon receptor (FCERI) signaling_Homo sapiens_R-HSA-2454202
64,0.0022807780585651226,256.7187329156616,Reactome_2016,FGB;FGA;FGG,27.777777777777768,0,0,3/432,9.689579987368171e-05,Gastrin-CREB signalling pathway via PKC and MAPK_Homo sapiens_R-HSA-881907
65,0.002536090707791253,243.21332659601032,Reactome_2016,FGB;FGA;FGG,26.66666666666667,0,0,3/450,0.00010939999131648544,Signalling by NGF_Homo sapiens_R-HSA-166520
66,0.0037293451093843967,203.18104146706975,Reactome_2016,FGB;FGA;FGG,23.30097087378641,0,0,3/515,0.00016331119106454547,Axon guidance_Homo sapiens_R-HSA-422475
67,0.006366400598907807,158.13360645345986,Reactome_2016,FGB;FGA;FGG,19.354838709677423,0,0,3/620,0.0002829511377292359,Cytokine Signaling in Immune system_Homo sapiens_R-HSA-1280215
68,0.012634265743945338,114.0497582058816,Reactome_2016,FGB;FGA;FGG,15.267175572519085,0,0,3/786,0.0005697806119818486,Developmental Biology_Homo sapiens_R-HSA-1266738
69,0.013458413106050171,109.92830678182276,Reactome_2016,FGB;FGA;FGG,14.86988847583643,0,0,3/807,0.0006157443904728838,Innate Immune System_Homo sapiens_R-HSA-168249
70,0.03768791926544938,3627.8621812078477,Reactome_2016,ALB,571.4285714285712,0,0,1/7,0.0017489165149326186,SLC transporter disorders_Homo sapiens_R-HSA-5619102
